00:00.0 PCI bridge: Actel Device 1556 (prog-if 00 [Normal decode])
	Control: I/O- Mem+ BusMaster+ SpecCycle- MemWINV- VGASnoop- ParErr- Stepping- SERR- FastB2B- DisINTx-
	Status: Cap+ 66MHz- UDF- FastB2B- ParErr- DEVSEL=fast >TAbort- <TAbort- <MAbort- >SERR- <PERR- INTx-
	Latency: 0
	Interrupt: pin D routed to IRQ 0
	Region 0: Memory at <unassigned> (64-bit, prefetchable)
	Bus: primary=00, secondary=01, subordinate=06, sec-latency=0
	I/O behind bridge: 0000f000-00000fff [empty]
	Memory behind bridge: 58000000-58bfffff [size=12M]
	Prefetchable memory behind bridge: 0000000040000000-0000000057ffffff [size=384M]
	Secondary status: 66MHz- FastB2B- ParErr- DEVSEL=fast >TAbort- <TAbort- <MAbort+ <SERR- <PERR-
	BridgeCtl: Parity- SERR- NoISA- VGA- VGA16- MAbort- >Reset- FastB2B-
		PriDiscTmr- SecDiscTmr- DiscTmrStat- DiscTmrSERREn-
	Capabilities: <access denied>
lspci: Unable to load libkmod resources: error -12

01:00.0 PCI bridge: PMC-Sierra Inc. Device 8561 (prog-if 00 [Normal decode])
	Control: I/O- Mem+ BusMaster+ SpecCycle- MemWINV- VGASnoop- ParErr- Stepping- SERR- FastB2B- DisINTx-
	Status: Cap+ 66MHz- UDF- FastB2B- ParErr- DEVSEL=fast >TAbort- <TAbort- <MAbort- >SERR- <PERR- INTx-
	Latency: 0
	Bus: primary=01, secondary=02, subordinate=06, sec-latency=0
	I/O behind bridge: 0000f000-00000fff [empty]
	Memory behind bridge: 58000000-58bfffff [size=12M]
	Prefetchable memory behind bridge: 0000000040000000-0000000057ffffff [size=384M]
	Secondary status: 66MHz- FastB2B- ParErr- DEVSEL=fast >TAbort- <TAbort- <MAbort- <SERR- <PERR-
	BridgeCtl: Parity- SERR- NoISA- VGA- VGA16- MAbort- >Reset- FastB2B-
		PriDiscTmr- SecDiscTmr- DiscTmrStat- DiscTmrSERREn-
	Capabilities: <access denied>

02:00.0 PCI bridge: PMC-Sierra Inc. Device 8561 (prog-if 00 [Normal decode])
	Control: I/O- Mem+ BusMaster+ SpecCycle- MemWINV- VGASnoop- ParErr- Stepping- SERR- FastB2B- DisINTx-
	Status: Cap+ 66MHz- UDF- FastB2B- ParErr- DEVSEL=fast >TAbort- <TAbort- <MAbort- >SERR- <PERR- INTx-
	Latency: 0
	Bus: primary=02, secondary=03, subordinate=03, sec-latency=0
	I/O behind bridge: 0000f000-00000fff [empty]
	Memory behind bridge: 58000000-582fffff [size=3M]
	Prefetchable memory behind bridge: 0000000050400000-00000000505fffff [size=2M]
	Secondary status: 66MHz- FastB2B- ParErr- DEVSEL=fast >TAbort- <TAbort- <MAbort- <SERR- <PERR-
	BridgeCtl: Parity- SERR- NoISA- VGA- VGA16- MAbort- >Reset- FastB2B-
		PriDiscTmr- SecDiscTmr- DiscTmrStat- DiscTmrSERREn-
	Capabilities: <access denied>

02:01.0 PCI bridge: PMC-Sierra Inc. Device 8561 (prog-if 00 [Normal decode])
	Control: I/O- Mem+ BusMaster+ SpecCycle- MemWINV- VGASnoop- ParErr- Stepping- SERR- FastB2B- DisINTx-
	Status: Cap+ 66MHz- UDF- FastB2B- ParErr- DEVSEL=fast >TAbort- <TAbort- <MAbort- >SERR- <PERR- INTx-
	Latency: 0
	Bus: primary=02, secondary=04, subordinate=04, sec-latency=0
	I/O behind bridge: 0000f000-00000fff [empty]
	Memory behind bridge: 58900000-58bfffff [size=3M]
	Prefetchable memory behind bridge: 0000000040000000-000000004fffffff [size=256M]
	Secondary status: 66MHz- FastB2B- ParErr- DEVSEL=fast >TAbort- <TAbort- <MAbort- <SERR- <PERR-
	BridgeCtl: Parity- SERR- NoISA- VGA- VGA16- MAbort- >Reset- FastB2B-
		PriDiscTmr- SecDiscTmr- DiscTmrStat- DiscTmrSERREn-
	Capabilities: <access denied>

02:02.0 PCI bridge: PMC-Sierra Inc. Device 8561 (prog-if 00 [Normal decode])
	Control: I/O- Mem+ BusMaster+ SpecCycle- MemWINV- VGASnoop- ParErr- Stepping- SERR- FastB2B- DisINTx-
	Status: Cap+ 66MHz- UDF- FastB2B- ParErr- DEVSEL=fast >TAbort- <TAbort- <MAbort- >SERR- <PERR- INTx-
	Latency: 0
	Bus: primary=02, secondary=05, subordinate=05, sec-latency=0
	I/O behind bridge: 0000f000-00000fff [empty]
	Memory behind bridge: 58600000-588fffff [size=3M]
	Prefetchable memory behind bridge: 0000000050200000-00000000503fffff [size=2M]
	Secondary status: 66MHz- FastB2B- ParErr- DEVSEL=fast >TAbort- <TAbort- <MAbort- <SERR- <PERR-
	BridgeCtl: Parity- SERR- NoISA- VGA- VGA16- MAbort- >Reset- FastB2B-
		PriDiscTmr- SecDiscTmr- DiscTmrStat- DiscTmrSERREn-
	Capabilities: <access denied>

02:03.0 PCI bridge: PMC-Sierra Inc. Device 8561 (prog-if 00 [Normal decode])
	Control: I/O- Mem+ BusMaster+ SpecCycle- MemWINV- VGASnoop- ParErr- Stepping- SERR- FastB2B- DisINTx-
	Status: Cap+ 66MHz- UDF- FastB2B- ParErr- DEVSEL=fast >TAbort- <TAbort- <MAbort- >SERR- <PERR- INTx-
	Latency: 0
	Bus: primary=02, secondary=06, subordinate=06, sec-latency=0
	I/O behind bridge: 0000f000-00000fff [empty]
	Memory behind bridge: 58300000-585fffff [size=3M]
	Prefetchable memory behind bridge: 0000000050000000-00000000501fffff [size=2M]
	Secondary status: 66MHz- FastB2B- ParErr- DEVSEL=fast >TAbort- <TAbort- <MAbort- <SERR- <PERR-
	BridgeCtl: Parity- SERR- NoISA- VGA- VGA16- MAbort- >Reset- FastB2B-
		PriDiscTmr- SecDiscTmr- DiscTmrStat- DiscTmrSERREn-
	Capabilities: <access denied>

03:00.0 USB controller: VIA Technologies, Inc. VL805 USB 3.0 Host Controller (rev 01) (prog-if 30 [XHCI])
	Subsystem: VIA Technologies, Inc. VL805 USB 3.0 Host Controller
	Control: I/O- Mem+ BusMaster+ SpecCycle- MemWINV- VGASnoop- ParErr- Stepping- SERR- FastB2B- DisINTx+
	Status: Cap+ 66MHz- UDF- FastB2B- ParErr- DEVSEL=fast >TAbort- <TAbort- <MAbort- >SERR- <PERR- INTx-
	Latency: 0, Cache Line Size: 64 bytes
	Interrupt: pin A routed to IRQ 55
	Region 0: Memory at 58000000 (64-bit, non-prefetchable) [size=4K]
	Capabilities: <access denied>
	Kernel driver in use: xhci_hcd

04:00.0 VGA compatible controller: Advanced Micro Devices, Inc. [AMD/ATI] Caicos [Radeon HD 6450/7450/8450 / R5 230 OEM] (prog-if 00 [VGA controller])
	Subsystem: PC Partner Limited / Sapphire Technology Radeon HD 6450 1 GB DDR3
	Control: I/O- Mem+ BusMaster+ SpecCycle- MemWINV- VGASnoop- ParErr- Stepping- SERR- FastB2B- DisINTx+
	Status: Cap+ 66MHz- UDF- FastB2B- ParErr- DEVSEL=fast >TAbort- <TAbort- <MAbort- >SERR- <PERR- INTx-
	Latency: 0
	Interrupt: pin A routed to IRQ 45
	Region 0: Memory at 40000000 (64-bit, prefetchable) [size=256M]
	Region 2: Memory at 58900000 (64-bit, non-prefetchable) [size=128K]
	Region 4: I/O ports at <unassigned> [disabled]
	Expansion ROM at 58920000 [disabled] [size=128K]
	Capabilities: <access denied>
	Kernel driver in use: radeon

04:00.1 Audio device: Advanced Micro Devices, Inc. [AMD/ATI] Caicos HDMI Audio [Radeon HD 6450 / 7450/8450/8490 OEM / R5 230/235/235X OEM]
	Subsystem: PC Partner Limited / Sapphire Technology Radeon HD 6450 1GB DDR3
	Control: I/O- Mem- BusMaster- SpecCycle- MemWINV- VGASnoop- ParErr- Stepping- SERR- FastB2B- DisINTx-
	Status: Cap+ 66MHz- UDF- FastB2B- ParErr- DEVSEL=fast >TAbort- <TAbort- <MAbort- >SERR- <PERR- INTx-
	Interrupt: pin B routed to IRQ 255
	Region 0: Memory at 58940000 (64-bit, non-prefetchable) [disabled] [size=16K]
	Capabilities: <access denied>

05:00.0 Non-Volatile memory controller: Sandisk Corp Device 5002 (prog-if 02 [NVM Express])
	Subsystem: Sandisk Corp Device 5002
	Control: I/O- Mem+ BusMaster+ SpecCycle- MemWINV- VGASnoop- ParErr- Stepping- SERR- FastB2B- DisINTx+
	Status: Cap+ 66MHz- UDF- FastB2B- ParErr- DEVSEL=fast >TAbort- <TAbort- <MAbort- >SERR- <PERR- INTx-
	Latency: 0
	Interrupt: pin A routed to IRQ 46
	Region 0: Memory at 58600000 (64-bit, non-prefetchable) [size=16K]
	Region 4: Memory at 58604000 (64-bit, non-prefetchable) [size=256]
	Capabilities: <access denied>
	Kernel driver in use: nvme

06:00.0 SATA controller: Marvell Technology Group Ltd. 88SE9125 PCIe SATA 6.0 Gb/s controller (rev 20) (prog-if 01 [AHCI 1.0])
	Subsystem: Marvell Technology Group Ltd. 88SE9125 PCIe SATA 6.0 Gb/s controller
	Control: I/O+ Mem+ BusMaster+ SpecCycle- MemWINV- VGASnoop- ParErr- Stepping- SERR- FastB2B- DisINTx+
	Status: Cap+ 66MHz- UDF- FastB2B- ParErr- DEVSEL=fast >TAbort- <TAbort- <MAbort- >SERR- <PERR- INTx-
	Latency: 0
	Interrupt: pin A routed to IRQ 49
	Region 0: I/O ports at 0000
	Region 1: I/O ports at 0000
	Region 2: I/O ports at 0000
	Region 3: I/O ports at 0000
	Region 4: I/O ports at 0000
	Region 5: Memory at 58310000 (32-bit, non-prefetchable) [size=2K]
	Expansion ROM at 58300000 [disabled] [size=64K]
	Capabilities: <access denied>
	Kernel driver in use: ahci